{
  "schemaVersion": "research-data-v1",
  "machine": {"machineId":"S_CHABUDAI_EB6","displayName":"ウルトラちゃぶ台返し","modelNumber":"SチャブダイEB6","manufacturer":"ベルコ","settings":["SET_1","SET_2","SET_3","SET_4","SET_6"],"identitySourceRefs":["SRC_1GEKI","SRC_PWORLD"]},
  "researchedAt": "2026-08-26",
  "sources": [
    {"sourceId":"SRC_1GEKI","publisher":"一撃","title":"ウルトラちゃぶ台返し 設定判別","url":"https://1geki.jp/slot/s_ultra_chabu/0/","checkedAt":"2026-08-26","sourceType":"major_analysis"},
    {"sourceId":"SRC_PWORLD","publisher":"P-WORLD","title":"ウルトラちゃぶ台返し","url":"https://www.p-world.co.jp/machine/database/9818","checkedAt":"2026-08-26","sourceType":"major_analysis"}
  ],
  "features": [
    {"researchFeatureId":"RF_AT_INITIAL","name":"AT初当り","factStatus":"verified","candidateModel":"binomial","trialUnit":"通常ゲーム","numeratorDefinition":"AT初当り回数","denominatorDefinition":"通常時ゲーム数","settingValues":{"SET_1":{"probability":0.0041614648,"rawDisplay":"1/240.3"},"SET_2":{"probability":0.0042354934,"rawDisplay":"1/236.1"},"SET_3":{"probability":0.0043252595,"rawDisplay":"1/231.2"},"SET_4":{"probability":0.00443066,"rawDisplay":"1/225.7"},"SET_6":{"probability":0.0045167118,"rawDisplay":"1/221.4"}},"sourceRefs":["SRC_1GEKI","SRC_PWORLD"],"crossSourceStatus":"matched"},
    {"researchFeatureId":"RF_REG_KIMARITE_COLOR","name":"REG中ちゃぶ投げ決まり手の色","factStatus":"pending","candidateModel":"unknown","trialUnit":"REG中表示4回","numeratorDefinition":"青・緑・赤・金の各出現回数","denominatorDefinition":"REG中の決まり手表示回数","settingValues":{},"sourceRefs":["SRC_1GEKI","SRC_PWORLD"],"crossSourceStatus":"matched","notes":"高設定ほど上位色が出やすい傾向は公開されているが設定別振分未公表。数値Inference不可。"}
  ],
  "evidenceCandidates": [],
  "conflicts": []
}
